Disease,Category,Severity,Symptoms,Additional_Symptoms,Risk_Factors
Pleural Effusion,Respiratory,Moderate to Severe,"Shortness of breath, chest pain worsening on inhalation, dry non-productive cough","Fever if infection present, hiccups, difficulty lying flat","Heart failure, pneumonia, cancer, liver disease, pulmonary embolism"
Sleep Apnea,Respiratory,Mild to Moderate,"Loud snoring, gasping or choking during sleep, excessive daytime sleepiness, morning headaches","Difficulty concentrating, mood changes, dry mouth, frequent nighttime urination","Obesity, large neck circumference, smoking, alcohol, nasal congestion, age"
Pulmonary Embolism,Respiratory,Severe,"Sudden shortness of breath, chest pain worsening with breathing, rapid heart rate, cough","Coughing blood, leg swelling, excessive sweating, light-headedness, bluish lips","Deep vein thrombosis, prolonged immobility, surgery, cancer, pregnancy"
Celiac Sprue,Gastrointestinal,Moderate,"Diarrhea after gluten exposure, abdominal bloating, gas and cramping, weight loss","Nausea, vomiting, constipation, pale foul-smelling stool, fatigue","Genetic predisposition, family history, Type 1 diabetes, Down syndrome"
Crohn's Disease,Gastrointestinal,Moderate to Severe,"Persistent diarrhea, abdominal pain and cramping, blood in stool, weight loss","Fatigue, reduced appetite, fever, mouth sores, anal fissures","Family history, smoking, NSAID use, age under 30, urban living"
Ulcerative Colitis,Gastrointestinal,Moderate to Severe,"Bloody diarrhea, abdominal cramping, urgency to defecate, weight loss","Fatigue, fever, rectal pain, failure to defecate despite urgency","Family history, age 15-30 or over 60, Jewish ancestry, urban living"
Gallstones,Gastrointestinal,Mild to Severe,"Sudden intense pain in upper right abdomen, pain radiating to shoulder, nausea","Vomiting, back pain between shoulder blades, clay-colored stools, jaundice","Female sex, obesity, age over 40, pregnancy, rapid weight loss, cholesterol"
Diverticulitis,Gastrointestinal,Moderate to Severe,"Severe abdominal pain usually lower left side, fever, nausea, change in bowel habits","Bloating, constipation or diarrhea, blood in stool, tender abdomen","Age over 40, low-fiber diet, obesity, smoking, sedentary lifestyle"
Hemorrhoids,Gastrointestinal,Mild,"Rectal bleeding during bowel movements, itching around anus, pain or discomfort","Swelling around anus, leakage of feces, feeling of incomplete emptying","Straining during bowel movements, chronic constipation, pregnancy, obesity"
Vitiligo,Dermatological,Mild,"White patches on skin starting on hands face or genitals, premature hair greying","Loss of color in mouth or nose lining, color change in retina","Autoimmune conditions, family history, sunburn, stress, chemical exposure"
Rosacea,Dermatological,Mild to Moderate,"Facial redness flushing easily, visible blood vessels on face, pimple-like bumps","Eye irritation, skin thickening especially on nose, burning sensation","Fair skin, age 30-60, female sex, family history, sun exposure, hot beverages"
Alopecia Areata,Dermatological,Mild to Moderate,"Patchy hair loss on scalp, smooth round bald patches, hair loss on eyebrows or beard","Nail pitting or ridging, burning sensation before hair loss, anxiety, depression","Autoimmune conditions, family history, stress, thyroid disease"
Scabies,Dermatological,Mild,"Intense itching especially at night, pimple-like rash, burrow tracks on skin","Secondary bacterial infection from scratching, rash in skin folds, crusted scabies","Close physical contact, crowded living conditions, weakened immunity"
Hypothermia,Emergency,Severe,"Shivering, slurred speech, slow shallow breathing, weak pulse, confusion","Drowsiness, loss of coordination, bright red cold skin in infants, unconsciousness","Cold exposure, wet clothing, age extremes, malnutrition, alcohol, cardiovascular disease"
Heat Stroke,Emergency,Severe,"High body temperature above 104F, altered mental state or confusion, nausea","Hot dry skin, rapid strong pulse, headache, dizziness, unconsciousness","Hot weather, strenuous activity, dehydration, alcohol, certain medications"
Anaphylaxis,Emergency,Severe,"Skin reactions including hives and flushing, throat tightening, difficulty breathing","Weak rapid pulse, nausea, vomiting, dizziness, loss of consciousness","Food allergies especially nuts or shellfish, insect stings, medications, latex"
Sepsis,Emergency,Severe,"Fever or abnormally low temperature, elevated heart rate, rapid breathing, confusion","Extreme pain, clammy skin, decreased urine output, altered consciousness","Bacterial infection, age extremes, weak immunity, chronic disease, hospitalization"
Rickets,Pediatric,Moderate,"Delayed growth, pain in spine legs and pelvis, muscle weakness, bowed legs","Thickened wrists and ankles, breastbone projection, dental problems","Vitamin D deficiency, poor calcium intake, limited sun exposure, dark skin"
Kawasaki Disease,Pediatric,Moderate to Severe,"High prolonged fever, rash, swollen lymph nodes in neck, red eyes without discharge","Red cracked lips, swollen hands and feet, peeling skin on fingers, irritability","Age under 5, Asian or Pacific Islander ethnicity, male sex, genetic factors"
Hand Foot and Mouth Disease,Pediatric,Mild,"Fever, painful sores in mouth, rash with blisters on hands and feet","Loss of appetite, sore throat, irritability, drooling in infants","Age under 5, daycare attendance, summer or fall season, contact with infected"
Croup,Pediatric,Mild to Moderate,"Barking cough, stridor, hoarse voice, low-grade fever, respiratory distress","Difficulty breathing especially at night, restlessness, cyanosis in severe cases","Age 6 months to 3 years, autumn and winter, male sex, viral infections"
Sickle Cell Disease,Hematologic,Severe,"Episodes of pain (crises) in chest back arms and legs, swelling in hands and feet, fatigue","Frequent infections, delayed growth, vision problems, jaundice, anemia","Both parents carrying sickle cell trait, African or Mediterranean ancestry"
Hemophilia,Hematologic,Moderate to Severe,"Excessive bleeding from cuts, prolonged bleeding after injury, easy bruising","Spontaneous bleeding into joints or muscles, deep internal bleeding, pain and swelling","X-linked genetic mutation, family history, almost exclusively in males"
Polycythemia Vera,Hematologic,Moderate,"Itching after bathing, headaches, dizziness, redness of face, sweating","Fatigue, shortness of breath, numbness in extremities, gout, spleen enlargement","JAK2 mutation, age over 60, male sex, family history"
Thalassemia,Hematologic,Mild to Severe,"Fatigue, weakness, pale or yellowish skin, facial bone deformities, slow growth","Abdominal swelling, dark urine, frequent infections, bone pain","Both parents carrying the trait, Mediterranean, Middle Eastern or Asian ancestry"
Addison's Disease,Endocrine,Moderate to Severe,"Fatigue, weight loss, low blood pressure, darkening of skin, muscle weakness","Nausea, vomiting, diarrhea, abdominal pain, craving for salt, depression","Autoimmune destruction, tuberculosis, HIV, blood thinners, cancer"
Cushing's Syndrome,Endocrine,Moderate,"Weight gain especially in face and trunk, purple stretch marks, easy bruising","Thin fragile skin, slow wound healing, facial hair in women, irregular periods","Prolonged corticosteroid use, pituitary or adrenal tumor, family history"
Acromegaly,Endocrine,Moderate,"Enlarged hands and feet, facial features coarsening, enlarged tongue, joint pain","Excessive sweating, body odor, sleep apnea, headaches, vision changes","Growth hormone secreting pituitary tumor, usually sporadic, rarely genetic"
Raynaud's Disease,Vascular,Mild,"Fingers and toes turning white then blue then red in response to cold or stress","Numbness tingling and pain during color changes, throbbing on rewarming","Female sex, age under 30, family history, cold climate, autoimmune disease"
Varicose Veins,Vascular,Mild,"Dark purple or blue twisted bulging veins visible under skin, aching heavy legs","Burning throbbing itching around veins, swelling, skin ulcers in severe cases","Age, female sex, pregnancy, obesity, prolonged standing, family history"
Lymphedema,Vascular,Moderate,"Swelling in arm or leg, feeling of heaviness or tightness, restricted range of motion","Aching or discomfort, recurring infections, hardening or thickening of skin","Cancer treatment, lymph node removal, infection, obesity, venous insufficiency"
Osteoarthritis,Musculoskeletal,Moderate,"Joint pain worsening with activity, stiffness especially in morning, grating sensation","Loss of flexibility, bone spurs, swelling, joint tenderness","Age over 50, obesity, joint injury, repetitive stress, family history, female sex"
Tendinitis,Musculoskeletal,Mild to Moderate,"Pain and tenderness near a joint, worsens with movement, mild swelling","Warmth around joint, reduced range of motion, pain at night","Repetitive motion, sudden increase in activity, age, poor posture, diabetes"
Bursitis,Musculoskeletal,Mild to Moderate,"Achy or stiff joint, pain worsens with movement or pressure, swelling and redness","Warmth around joint, limited range of motion, fever if infected","Repetitive motions, prolonged pressure, joint injury, gout, rheumatoid arthritis"
Carpal Tunnel Syndrome,Musculoskeletal,Mild to Moderate,"Numbness and tingling in hand and arm, weakness in hand, pain radiating to arm","Electric shock-like sensations, dropping objects, symptoms worse at night","Repetitive hand motions, female sex, diabetes, obesity, pregnancy, wrist anatomy"
Plantar Fasciitis,Musculoskeletal,Mild to Moderate,"Sharp heel pain especially with first steps in morning, pain after long periods of standing","Tenderness along arch of foot, stiffness, difficulty climbing stairs","Age 40-60, obesity, occupations requiring standing, flat feet or high arches"
Chronic Fatigue Syndrome,Neurological,Moderate to Severe,"Extreme fatigue not improved by rest, worsening symptoms after physical activity, sleep problems","Cognitive difficulties, headaches, sore throat, swollen lymph nodes, muscle pain","Viral infections, immune dysfunction, hormonal imbalances, psychological stress"
Vertigo,Neurological,Mild to Moderate,"Sensation of spinning or motion when still, nausea and vomiting, balance problems","Hearing loss, ringing in ears, headache, abnormal eye movements, sweating","Inner ear disorders, head injury, migraines, certain medications, Meniere's disease"
Bell's Palsy,Neurological,Moderate,"Sudden weakness or paralysis on one side of face, drooping of mouth or eyelid","Drooling, dry eye, loss of taste, headache, sensitivity to sound, facial pain","Viral infection especially herpes, diabetes, pregnancy, age 15-60"
Trigeminal Neuralgia,Neurological,Moderate to Severe,"Sudden severe facial pain like electric shock, triggered by touch or chewing","Brief attacks lasting seconds to minutes, facial muscle spasms, pain in jaw or cheek","Age over 50, female sex, multiple sclerosis, blood vessel compression of nerve"
Narcolepsy,Neurological,Moderate,"Excessive daytime sleepiness, sudden muscle weakness triggered by emotion (cataplexy)","Sleep paralysis, hallucinations when falling asleep, disrupted nighttime sleep","Hypocretin deficiency, autoimmune factors, brain injury, family history"
